{
  "schemaVersion": "1.0",
  "meta": {
    "title": "Der platte Reifen",
    "textLanguage": "de",
    "explanationLanguage": "zh-CN",
    "genre": "article",
    "mode": "study",
    "createdAt": "2026-10-26T12:00:00Z",
    "register": "Colloquial first-person narrative with separable verbs",
    "level": {
      "strategy": "default-adaptive",
      "declared": null
    },
    "notes": [
      "示例用文本为本项目自拟，用于测试流程。"
    ]
  },
  "source": {
    "text": "Als ich letzten Winter mein altes Fahrrad aus dem Keller holte, war der Vorderreifen platt. Eigentlich wollte ich es gleich zur Werkstatt bringen, aber dann dachte ich mir: Das kriegst du auch allein hin.\n\nZwei Stunden und drei falsche Schläuche später saß ich fluchend auf dem Küchenboden. Zum Glück kam meine Nachbarin vorbei, die so etwas im Handumdrehen repariert. Sie hat mir gezeigt, worauf es ankommt — und seitdem flicke ich jeden Platten selbst.",
    "characterCount": 454,
    "sentenceCount": 5,
    "integrity": "preserved"
  },
  "sentences": [
    {
      "id": "s01-01",
      "paragraph": 1,
      "order": 1,
      "text": "Als ich letzten Winter mein altes Fahrrad aus dem Keller holte, war der Vorderreifen platt.",
      "translation": "去年冬天，我把那辆旧自行车从地下室搬出来时，前轮胎瘪了。",
      "vocabularyRefs": [
        "v001",
        "v002",
        "v003"
      ],
      "grammarRefs": [
        "g001"
      ]
    },
    {
      "id": "s01-02",
      "paragraph": 1,
      "order": 2,
      "text": "Eigentlich wollte ich es gleich zur Werkstatt bringen, aber dann dachte ich mir: Das kriegst du auch allein hin.",
      "translation": "本来我打算直接送去修车铺，可后来心想：这事儿你自己也搞得定。",
      "vocabularyRefs": [],
      "expressionRefs": [
        "e001"
      ],
      "grammarRefs": [
        "g002"
      ]
    },
    {
      "id": "s02-01",
      "paragraph": 2,
      "order": 3,
      "text": "Zwei Stunden und drei falsche Schläuche später saß ich fluchend auf dem Küchenboden.",
      "translation": "两个小时、三条不匹配的内胎之后，我一边骂骂咧咧一边坐在厨房地板上。",
      "vocabularyRefs": [
        "v004",
        "v005"
      ],
      "grammarRefs": []
    },
    {
      "id": "s02-02",
      "paragraph": 2,
      "order": 4,
      "text": "Zum Glück kam meine Nachbarin vorbei, die so etwas im Handumdrehen repariert.",
      "translation": "幸亏邻居路过——她修这种东西一转眼就好。",
      "vocabularyRefs": [],
      "expressionRefs": [
        "e002",
        "e003"
      ],
      "grammarRefs": [
        "g003"
      ]
    },
    {
      "id": "s02-03",
      "paragraph": 2,
      "order": 5,
      "text": "Sie hat mir gezeigt, worauf es ankommt — und seitdem flicke ich jeden Platten selbst.",
      "translation": "她教了我关键在哪儿，从那以后，每个爆胎我都自己补。",
      "vocabularyRefs": [],
      "expressionRefs": [
        "e004"
      ],
      "grammarRefs": [
        "g004"
      ]
    }
  ],
  "vocabulary": [
    {
      "id": "v001",
      "surface": "Vorderreifen",
      "lemma": "Vorderreifen",
      "pos": "noun",
      "meaningInContext": "前轮胎；Vorder-（前面的）+ Reifen（轮胎）构成的复合名词。",
      "morphology": {
        "description": "复合名词，性别由最后一个成分 Reifen 决定，为阳性；复数形式通常仍为 Vorderreifen。",
        "features": [
          "compound",
          "masculine",
          "singular"
        ]
      },
      "gender": "masculine",
      "examples": [
        {
          "text": "Der Vorderreifen hat zu wenig Luft.",
          "translation": "前轮胎气不足。"
        }
      ],
      "confusions": [
        {
          "term": "Vorderreifen vs. Hinterreifen",
          "distinction": "Vorderreifen 是前轮轮胎；Hinterreifen 是后轮轮胎。"
        }
      ],
      "sentenceRefs": [
        "s01-01"
      ],
      "priority": "medium",
      "confidence": "high",
      "needsVerification": false,
      "tags": [
        "compound"
      ]
    },
    {
      "id": "v002",
      "surface": "platt",
      "lemma": "platt",
      "pos": "adjective",
      "meaningInContext": "（轮胎）瘪了的；口语中也常指“累瘫了”。",
      "morphology": {
        "description": "作表语用的形容词，本句不涉及变格。",
        "features": [
          "predicative"
        ]
      },
      "examples": [
        {
          "text": "Nach der Wanderung war ich völlig platt.",
          "translation": "徒步之后我累瘫了。"
        }
      ],
      "confusions": [
        {
          "term": "platt vs. flach",
          "distinction": "platt 口语中常指轮胎瘪了或人累瘫；flach 指“平坦的”，是中性描写。"
        }
      ],
      "sentenceRefs": [
        "s01-01"
      ],
      "priority": "medium",
      "confidence": "high",
      "needsVerification": false,
      "tags": [
        "colloquial"
      ]
    },
    {
      "id": "v003",
      "surface": "Keller",
      "lemma": "Keller",
      "pos": "noun",
      "meaningInContext": "地下室、地窖；此处指存放自行车的楼下储藏空间。",
      "morphology": {
        "description": "阳性名词；本句受介词 aus 支配，用第三格 dem Keller。",
        "features": [
          "masculine",
          "dative",
          "singular"
        ]
      },
      "gender": "masculine",
      "examples": [
        {
          "text": "Die Fahrräder stehen im Keller.",
          "translation": "自行车放在地下室里。"
        }
      ],
      "sentenceRefs": [
        "s01-01"
      ],
      "priority": "medium",
      "confidence": "high",
      "needsVerification": false,
      "tags": [
        "case"
      ]
    },
    {
      "id": "v004",
      "surface": "Schläuche",
      "lemma": "Schlauch",
      "pos": "noun",
      "meaningInContext": "内胎；自行车语境中指 Fahrradschlauch，不是水管。",
      "morphology": {
        "description": "Schlauch 的复数形式：元音变音 + -e（Schlauch → Schläuche）。本句为第四格复数。",
        "features": [
          "masculine",
          "plural",
          "accusative",
          "umlaut"
        ]
      },
      "gender": "masculine",
      "examples": [
        {
          "text": "Ich habe zwei neue Schläuche gekauft.",
          "translation": "我买了两条新内胎。"
        }
      ],
      "confusions": [
        {
          "term": "Schlauch vs. Reifen",
          "distinction": "Schlauch 是内胎；Reifen 是外胎/轮胎整体。"
        }
      ],
      "sentenceRefs": [
        "s02-01"
      ],
      "priority": "high",
      "confidence": "high",
      "needsVerification": false,
      "tags": [
        "plural",
        "contextual-sense"
      ]
    },
    {
      "id": "v005",
      "surface": "fluchend",
      "lemma": "fluchen",
      "pos": "verb",
      "meaningInContext": "骂骂咧咧地、咒骂着；现在分词作状语，修饰 saß。",
      "morphology": {
        "description": "fluchen 的现在分词（Partizip I）：fluchen + -d。此处作方式状语，不变格。",
        "features": [
          "present-participle",
          "adverbial"
        ]
      },
      "examples": [
        {
          "text": "Er verließ fluchend den Raum.",
          "translation": "他骂骂咧咧地离开了房间。"
        }
      ],
      "sentenceRefs": [
        "s02-01"
      ],
      "priority": "medium",
      "confidence": "high",
      "needsVerification": false,
      "tags": [
        "participle"
      ]
    }
  ],
  "expressions": [
    {
      "id": "e001",
      "text": "Das kriegst du auch allein hin",
      "type": "phrasal-verb",
      "literalMeaning": "你也能独自把它弄到那边去。",
      "meaningInContext": "这事儿你自己也搞得定；表示相信对方能独立完成。",
      "register": "colloquial",
      "sensitivity": "none",
      "usageNotes": [
        "原形为 es hinkriegen；本句中变位部分 kriegst 在第二位，可分前缀 hin 位于句末。",
        "kriegen 偏口语；中性表达可用 schaffen。"
      ],
      "examples": [
        {
          "text": "Keine Sorge, das kriege ich hin.",
          "translation": "别担心，这事儿我搞得定。"
        }
      ],
      "alternatives": [
        "hinbekommen",
        "schaffen"
      ],
      "sentenceRefs": [
        "s01-02"
      ],
      "priority": "high",
      "confidence": "high",
      "needsVerification": false,
      "tags": [
        "separable",
        "colloquial"
      ]
    },
    {
      "id": "e002",
      "text": "im Handumdrehen",
      "type": "idiom",
      "literalMeaning": "在手的转动之中。",
      "meaningInContext": "一转眼、很快；形容动作迅速、毫不费力。",
      "register": "neutral",
      "sensitivity": "none",
      "examples": [
        {
          "text": "Sie hat das Problem im Handumdrehen gelöst.",
          "translation": "她一转眼就把问题解决了。"
        }
      ],
      "alternatives": [
        "im Nu",
        "blitzschnell"
      ],
      "sentenceRefs": [
        "s02-02"
      ],
      "priority": "high",
      "confidence": "high",
      "needsVerification": false
    },
    {
      "id": "e003",
      "text": "Zum Glück",
      "type": "collocation",
      "meaningInContext": "幸亏、幸运的是；用于引出避免了坏结果的情况。",
      "register": "neutral",
      "sensitivity": "none",
      "examples": [
        {
          "text": "Zum Glück hatte ich einen Regenschirm dabei.",
          "translation": "幸亏我带了伞。"
        }
      ],
      "alternatives": [
        "glücklicherweise"
      ],
      "sentenceRefs": [
        "s02-02"
      ],
      "priority": "medium",
      "confidence": "high",
      "needsVerification": false
    },
    {
      "id": "e004",
      "text": "worauf es ankommt",
      "type": "grammatical-expression",
      "literalMeaning": "它取决于什么。",
      "meaningInContext": "关键在于什么、重要的是什么；此处指邻居教她修胎的关键点。",
      "register": "neutral",
      "sensitivity": "none",
      "usageNotes": [
        "原形为 es kommt auf etwas an（取决于、重要的是）。",
        "worauf 是代词性副词，把介词 auf 的宾语前置；从句中变位动词 ankommt 位于句末。"
      ],
      "examples": [
        {
          "text": "Sie erklärte mir, worauf es beim Kochen ankommt.",
          "translation": "她向我解释了做饭的关键在哪里。"
        }
      ],
      "alternatives": [
        "was wichtig ist"
      ],
      "sentenceRefs": [
        "s02-03"
      ],
      "priority": "high",
      "confidence": "high",
      "needsVerification": false,
      "tags": [
        "separable",
        "pronominal-adverb"
      ]
    }
  ],
  "grammar": [
    {
      "id": "g001",
      "title": "als 从句与主句倒装",
      "explanation": "由 als 引导的时间从句中，变位动词 holte 位于句末。整个从句占据主句的第一位，因此主句的变位动词 war 紧跟在从句之后，主语 der Vorderreifen 反而位于动词之后：war der Vorderreifen platt。这是德语主句的框型结构（动词第二位）在从句前置时的必然结果。",
      "pattern": "Als + … + Verb(final), Verb + Subject + …",
      "examples": [
        {